{
  "$schema": "../schemas/security-controls.contract.schema.json",
  "contract_id": "security-controls",
  "version": "1.0.0",
  "status": "active",
  "language": "en",
  "title": "kOA Security Controls",
  "owner": "security_architecture",
  "authority": "canonical_control_identity_and_profile_applicability",
  "applicability_states": [
    "required",
    "recommended",
    "optional",
    "prohibited",
    "not_applicable"
  ],
  "profile_order": [
    "user_lightweight",
    "developer_linux_workstation",
    "developer_windows_wsl",
    "sovereign_linux_node",
    "sovereign_hub",
    "build_farm",
    "control_plane",
    "high_assurance",
    "sovereign_offline",
    "appliance_shell"
  ],
  "profiles": [
    {
      "profile_id": "user_lightweight",
      "label": "User Lightweight",
      "short_code": "UL",
      "contract_ref": "contracts/profiles/user-lightweight.profile.json"
    },
    {
      "profile_id": "developer_linux_workstation",
      "label": "Developer Linux Workstation",
      "short_code": "DL",
      "contract_ref": "contracts/profiles/developer-linux-workstation.profile.json"
    },
    {
      "profile_id": "developer_windows_wsl",
      "label": "Developer Windows WSL",
      "short_code": "DW",
      "contract_ref": "contracts/profiles/developer-windows-wsl.profile.json"
    },
    {
      "profile_id": "sovereign_linux_node",
      "label": "Sovereign Linux Node",
      "short_code": "SL",
      "contract_ref": "contracts/profiles/sovereign-linux-node.profile.json"
    },
    {
      "profile_id": "sovereign_hub",
      "label": "Sovereign Hub",
      "short_code": "SH",
      "contract_ref": "contracts/profiles/sovereign-hub.profile.json"
    },
    {
      "profile_id": "build_farm",
      "label": "Build Farm",
      "short_code": "BF",
      "contract_ref": "contracts/profiles/build-farm.profile.json"
    },
    {
      "profile_id": "control_plane",
      "label": "Control Plane",
      "short_code": "CP",
      "contract_ref": "contracts/profiles/control-plane.profile.json"
    },
    {
      "profile_id": "high_assurance",
      "label": "High Assurance",
      "short_code": "HA",
      "contract_ref": "contracts/profiles/high-assurance.profile.json"
    },
    {
      "profile_id": "sovereign_offline",
      "label": "Sovereign Offline Overlay",
      "short_code": "SO",
      "contract_ref": "contracts/profiles/sovereign-offline.profile.json"
    },
    {
      "profile_id": "appliance_shell",
      "label": "Appliance Shell Overlay",
      "short_code": "AS",
      "contract_ref": "contracts/profiles/appliance-shell.profile.json"
    }
  ],
  "invariants": [
    {
      "invariant_id": "SEC-INV-001",
      "title": "Verified activation",
      "statement": "No critical system, service, policy, or governed artifact becomes active without identity, digest, compatibility, and admission verification."
    },
    {
      "invariant_id": "SEC-INV-002",
      "title": "Default deny",
      "statement": "Filesystem, network, device, process, privilege, and external-integration access is denied unless explicitly declared."
    },
    {
      "invariant_id": "SEC-INV-003",
      "title": "No implicit privilege",
      "statement": "Locality, installation, user-interface visibility, application administration, or governance influence never implies machine privilege."
    },
    {
      "invariant_id": "SEC-INV-004",
      "title": "One owner per authoritative state",
      "statement": "No component directly mutates another owner’s private authoritative state."
    },
    {
      "invariant_id": "SEC-INV-005",
      "title": "Closed privileged operations",
      "statement": "No arbitrary shell command, path, unit, device operation, or capability crosses the privileged broker."
    },
    {
      "invariant_id": "SEC-INV-006",
      "title": "Traceable active artifacts",
      "statement": "Every active governed artifact has origin, version, digest, signature policy, provenance, compatibility, and applicable SBOM evidence."
    },
    {
      "invariant_id": "SEC-INV-007",
      "title": "Accountability without indiscriminate surveillance",
      "statement": "Critical actions are traceable while event collection and disclosure remain purpose-limited and privacy-minimized."
    },
    {
      "invariant_id": "SEC-INV-008",
      "title": "Proven recovery",
      "statement": "Backup, rollback, and recovery claims require successful exercises and retained evidence."
    }
  ],
  "categories": [
    {
      "category_id": "security_governance",
      "title": "Security governance and control architecture",
      "canonical_documents": [
        "07-security/00-threat-model.md",
        "07-security/21-security-control-architecture.md",
        "07-security/22-security-control-profile-matrix.md"
      ]
    },
    {
      "category_id": "platform_integrity",
      "title": "Platform integrity and activation",
      "canonical_documents": [
        "07-security/01-security-baseline.md",
        "07-security/04-trust-root-scoping.md",
        "07-security/09-storage-boundaries.md",
        "06-lifecycle/13-activation-and-verification.md",
        "06-lifecycle/14-recovery.md"
      ]
    },
    {
      "category_id": "identity_and_access",
      "title": "Identity and authorization",
      "canonical_documents": [
        "07-security/03-identity-trust-and-signatures.md",
        "07-security/05-privilege-boundaries.md"
      ]
    },
    {
      "category_id": "privilege",
      "title": "Privilege boundaries",
      "canonical_documents": [
        "07-security/05-privilege-boundaries.md",
        "07-security/06-privileged-broker.md"
      ]
    },
    {
      "category_id": "service_isolation",
      "title": "Service isolation",
      "canonical_documents": [
        "07-security/02-security-domains.md",
        "07-security/05-privilege-boundaries.md"
      ]
    },
    {
      "category_id": "key_and_secret_management",
      "title": "Keys and secrets",
      "canonical_documents": [
        "07-security/04-trust-root-scoping.md",
        "07-security/07-secrets-and-keys.md"
      ]
    },
    {
      "category_id": "network_security",
      "title": "Network security",
      "canonical_documents": [
        "07-security/08-network-boundaries.md",
        "07-security/12-external-integration-classification.md"
      ]
    },
    {
      "category_id": "data_security",
      "title": "Data security",
      "canonical_documents": [
        "07-security/09-storage-boundaries.md",
        "07-security/10-data-at-rest.md",
        "07-security/13-privacy-and-disclosure.md"
      ]
    },
    {
      "category_id": "offline_import_security",
      "title": "Offline import security",
      "canonical_documents": [
        "07-security/18-offline-import-security.md"
      ]
    },
    {
      "category_id": "supply_chain",
      "title": "Software supply chain",
      "canonical_documents": [
        "07-security/19-software-supply-chain.md",
        "06-lifecycle/18-sbom-provenance-and-signing.md"
      ]
    },
    {
      "category_id": "secure_development",
      "title": "Secure development",
      "canonical_documents": [
        "05-development/13-development-security.md",
        "05-development/14-build-test-and-validation.md"
      ]
    },
    {
      "category_id": "audit_and_detection",
      "title": "Audit and detection",
      "canonical_documents": [
        "07-security/15-selective-audit.md",
        "07-security/16-public-evidence-and-private-proof.md"
      ]
    },
    {
      "category_id": "incident_response",
      "title": "Incident response",
      "canonical_documents": [
        "08-operations/12-incident-response.md"
      ]
    },
    {
      "category_id": "recovery",
      "title": "Backup and recovery",
      "canonical_documents": [
        "08-operations/08-backup.md",
        "08-operations/09-restore.md",
        "08-operations/13-disaster-recovery.md"
      ]
    }
  ],
  "controls": [
    {
      "control_id": "SEC-GOV-001",
      "title": "Current scoped threat model",
      "category": "security_governance",
      "status": "active",
      "owner": "security_architecture",
      "canonical_document": "07-security/00-threat-model.md",
      "summary": "The deployment threat model identifies protected assets, trust boundaries, adversaries, abuse cases, preventive controls, detection paths, and recovery paths for the active profile.",
      "failure_behavior": "block_release",
      "evidence_class": "threat_model_evidence",
      "implementation_binding": "docs/07-security/00-threat-model.md",
      "validation_binding": "tests/security/threat-model/",
      "applicability": {
        "user_lightweight": "required",
        "developer_linux_workstation": "required",
        "developer_windows_wsl": "required",
        "sovereign_linux_node": "required",
        "sovereign_hub": "required",
        "build_farm": "required",
        "control_plane": "required",
        "high_assurance": "required",
        "sovereign_offline": "required",
        "appliance_shell": "required"
      }
    },
    {
      "control_id": "SEC-GOV-002",
      "title": "Explicit control applicability by profile",
      "category": "security_governance",
      "status": "active",
      "owner": "security_architecture",
      "canonical_document": "07-security/22-security-control-profile-matrix.md",
      "summary": "Every active security control is classified for every profile contract as required, recommended, optional, prohibited, or not applicable.",
      "failure_behavior": "block_conformance_claim",
      "evidence_class": "security_profile_evidence",
      "implementation_binding": "docs/contracts/security-controls.contract.json",
      "validation_binding": "docs/tools/check_security_architecture.py",
      "applicability": {
        "user_lightweight": "required",
        "developer_linux_workstation": "required",
        "developer_windows_wsl": "required",